{
  "$schema": "https://json-schema.org/draft/2020-12/schema",
  "$id": "https://raw.githubusercontent.com/kstone-sa/aesirguard-audit/main/schema/aesirguard-audit-v1.schema.json",
  "title": "AesirGuard Audit canonical event v1",
  "type": "object",
  "additionalProperties": false,
  "required": ["schema_version", "audit", "event"],
  "properties": {
    "schema_version": {"const": "1.0"},
    "audit": {"$ref": "#/$defs/audit"},
    "source": {"$ref": "#/$defs/source"},
    "event": {"$ref": "#/$defs/event"},
    "rule": {"$ref": "#/$defs/rule"},
    "actor": {"$ref": "#/$defs/identity"},
    "process": {"$ref": "#/$defs/process"},
    "target": {"$ref": "#/$defs/target"},
    "origin": {"$ref": "#/$defs/origin"},
    "security": {"$ref": "#/$defs/security"},
    "paths": {
      "type": "array",
      "minItems": 1,
      "items": {"$ref": "#/$defs/path"}
    },
    "message": {"type": "string"},
    "renderer_version": {"type": "string"}
  },
  "$defs": {
    "audit": {
      "type": "object",
      "additionalProperties": false,
      "properties": {
        "id": {"type": "string"},
        "time": {"type": "string", "format": "date-time"},
        "raw": {"type": "string"},
        "raw_encoding": {"const": "hex"}
      }
    },
    "source": {
      "type": "object",
      "additionalProperties": false,
      "required": ["host"],
      "properties": {"host": {"type": "string"}}
    },
    "event": {
      "type": "object",
      "additionalProperties": false,
      "required": ["type"],
      "properties": {
        "type": {"type": "string"},
        "category": {"type": "string"},
        "action": {"type": "string"},
        "original_action": {"type": "string"},
        "success": {"type": "boolean"},
        "integrity": {"$ref": "#/$defs/integrity"},
        "issues": {
          "type": "array",
          "minItems": 1,
          "items": {"$ref": "#/$defs/issue"}
        }
      }
    },
    "integrity": {
      "type": "object",
      "additionalProperties": false,
      "required": ["state", "reason"],
      "properties": {
        "state": {"const": "incomplete"},
        "reason": {"enum": ["watermark", "timeout", "eof", "shutdown", "source_gap", "assembly_limit", "line_limit"]}
      }
    },
    "issue": {
      "type": "object",
      "additionalProperties": false,
      "required": ["code"],
      "properties": {
        "code": {"type": "string"},
        "record_type": {"type": "string"},
        "field": {"type": "string"},
        "value": {"type": "string"},
        "value_encoding": {"const": "hex"},
        "record_index": {"type": "integer", "minimum": 0},
        "quoted": {"type": "boolean"},
        "source": {"enum": ["raw", "interpreted", "embedded"]}
      }
    },
    "rule": {
      "type": "object",
      "additionalProperties": false,
      "required": ["keys"],
      "properties": {
        "keys": {"type": "array", "minItems": 1, "items": {"type": "string"}}
      }
    },
    "identity": {
      "type": "object",
      "additionalProperties": false,
      "properties": {
        "user": {"type": "string"},
        "user_id": {"type": "string"}
      }
    },
    "process": {
      "type": "object",
      "additionalProperties": false,
      "properties": {
        "pid": {"type": "string"},
        "ppid": {"type": "string"},
        "user": {"type": "string"},
        "user_id": {"type": "string"},
        "real_user": {"type": "string"},
        "real_user_id": {"type": "string"},
        "name": {"type": "string"},
        "executable": {"type": "string"},
        "argv": {"type": "array", "minItems": 1, "items": {"type": "string"}},
        "audit_attribution": {"$ref": "#/$defs/audit_attribution"},
        "command": {"type": "string"},
        "command_source": {"enum": ["user_cmd"]},
        "argv_source": {"enum": ["execve", "proctitle"]},
        "cwd": {"type": "string"},
        "tty": {"type": "string"},
        "architecture_code": {"type": "string"},
        "syscall": {"type": "string"},
        "syscall_number": {"type": "string"},
        "return_value": {"type": "string"}
      }
    },
    "audit_attribution": {
      "type": "object",
      "additionalProperties": false,
      "minProperties": 1,
      "properties": {
        "old": {"$ref": "#/$defs/audit_attribution_identity"},
        "new": {"$ref": "#/$defs/audit_attribution_identity"}
      }
    },
    "audit_attribution_identity": {
      "type": "object",
      "additionalProperties": false,
      "minProperties": 1,
      "properties": {
        "loginuid": {"type": "string"},
        "user": {"type": "string"},
        "loginuid_unset": {"const": true},
        "session_id": {"type": "string"},
        "session_unset": {"const": true}
      }
    },
    "target": {
      "type": "object",
      "additionalProperties": false,
      "properties": {
        "user": {"type": "string"},
        "user_id": {"type": "string"},
        "service": {"type": "string"},
        "name": {"type": "string"}
      }
    },
    "origin": {
      "type": "object",
      "additionalProperties": false,
      "properties": {
        "address": {"type": "string"},
        "host": {"type": "string"},
        "terminal": {"type": "string"}
      }
    },
    "security": {
      "type": "object",
      "additionalProperties": false,
      "properties": {
        "decision": {"type": "string"},
        "permissions": {"type": "array", "minItems": 1, "items": {"type": "string"}},
        "subject_context": {"type": "string"},
        "target_context": {"type": "string"},
        "target_class": {"type": "string"},
        "profile": {"type": "string"},
        "permissive": {"type": "boolean"},
        "seccomp": {"$ref": "#/$defs/seccomp"}
      }
    },
    "seccomp": {
      "type": "object",
      "additionalProperties": false,
      "required": ["action"],
      "properties": {
        "action": {"enum": ["kill_thread", "kill_process", "trap", "errno", "user_notif", "trace", "log", "allow", "unknown"]},
        "code": {"type": "string"},
        "signal": {"type": "string"},
        "instruction_pointer": {"type": "string"}
      }
    },
    "path": {
      "type": "object",
      "additionalProperties": false,
      "properties": {
        "name": {"type": "string"},
        "name_type": {"type": "string"},
        "owner": {"type": "string"},
        "owner_id": {"type": "string"},
        "group": {"type": "string"},
        "group_id": {"type": "string"},
        "capabilities": {"$ref": "#/$defs/capabilities"}
      }
    },
    "capabilities": {
      "type": "object",
      "additionalProperties": false,
      "properties": {
        "permitted": {"type": "array", "minItems": 1, "items": {"type": "string"}},
        "inheritable": {"type": "array", "minItems": 1, "items": {"type": "string"}},
        "effective": {"type": "boolean"}
      }
    }
  }
}
